{
    "$schema": "http://json-schema.org/draft-07/schema#",
    "title": "Hatch Package Metadata",
    "description": "Schema for Hatch MCP Server package metadata with dual entry point support and conda channel support",
    "type": "object",
    "required": ["package_schema_version", "name", "version", "entry_point", "description", "tags", "author", "license"],
    "properties": {
        "$schema": {
            "type": "string",
            "format": "uri",
            "description": "JSON Schema reference URI"
        },
        "package_schema_version": {
            "type": "string",
            "description": "Version of the schema used for this package metadata",
            "pattern": "^1\\.2\\.2$"
        },
        "name": {
            "type": "string",
            "description": "Package identifier",
            "pattern": "^[a-z0-9_]+$"
        },
        "version": {
            "type": "string",
            "description": "Semantic version of the package",
            "pattern": "^\\d+(\\.\\d+)*$"
        },
        "description": {
            "type": "string",
            "description": "Human-readable description of the package"
        },
        "tags": {
            "type": "array",
            "items": {"type": "string"},
            "description": "Keywords for discovery"
        },
        "author": {
            "type": "object",
            "required": ["name"],
            "properties": {
                "name": {"type": "string"},
                "email": {"type": "string", "format": "email"}
            }
        },
        "contributors": {
            "type": "array",
            "items": {
                "type": "object",
                "required": ["name"],
                "properties": {
                    "name": {"type": "string"},
                    "email": {"type": "string", "format": "email"}
                }
            }
        },
        "license": {
            "type": "object",
            "required": ["name"],
            "properties": {
                "name": {
                    "type": "string",
                    "description": "Name of the license"
                },
                "uri": {
                    "type": "string",
                    "format": "uri",
                    "description": "URL to the license text. It can point to a file in the package or an external URL."
                }
            }
        },
        "repository": {"type": "string", "format": "uri"},
        "documentation": {"type": "string", "format": "uri"},
        "dependencies": {
            "type": "object",
            "properties": {
                "hatch": {
                    "type": "array",
                    "items": {
                        "type": "object",
                        "required": ["name", "version_constraint"],
                        "properties": {
                            "name": {
                                "type": "string",
                                "pattern": "^[A-Za-z0-9_\\-./\\\\:]+$",
                                "description": "Name of the Hatch package. The name can match an absolute or relative path for local packages. If it is a relative path, it is relative to the package's root directory. For remote packages (i.e. Hatch registry), a single name or, to remove ambiguity, the name prepended with the repository name, e.g., '<hatch-repo-name>:<package-name>'."
                            },
                            "version_constraint": {
                                "type": "string",
                                "pattern": "^\\s*(==|>=|<=|!=)\\s*\\d+(\\.\\d+)*$",
                                "description": "Version constraint for the Hatch package"
                            }
                        }
                    },
                    "description": "Hatch packages required."
                },
                "python": {
                    "type": "array",
                    "items": {
                        "type": "object",
                        "required": ["name", "version_constraint"],
                        "properties": {
                            "name": {
                                "type": "string",
                                "pattern": "^[\\w\\-./\\\\]+$",
                                "description": "Name of the Python package. The name can match an absolute or relative path to a directory to a local package. If it is a relative path, it is relative to the package's root directory."
                            },
                            "version_constraint": {
                                "type": "string",
                                "pattern": "^\\s*(==|>=|<=|!=)\\s*\\d+(\\.\\d+)*$",
                                "description": "Version constraint for the Python package"
                            },
                            "package_manager": {
                                "type": "string",
                                "enum": ["pip", "conda"],
                                "default": "pip",
                                "description": "Package manager to use for installation"
                            },
                            "channel": {
                                "type": "string",
                                "pattern": "^[a-zA-Z0-9_\\-]+$",
                                "description": "Conda channel to use when package_manager is 'conda' (e.g., 'colomoto', 'conda-forge', 'bioconda'). Only applicable when package_manager is 'conda'."
                            }
                        }
                    },
                    "description": "Python packages required."
                },
                "system": {
                    "type": "array",
                    "items": {
                        "type": "object",
                        "required": ["name", "version_constraint"],
                        "properties": {
                            "name": {
                                "type": "string",
                                "pattern": "^\\w+$",
                                "description": "Name of the system package"
                            },
                            "version_constraint": {
                                "type": "string",
                                "pattern": "^\\s*(==|>=|<=|!=)\\s*\\d+(\\.\\d+)*$",
                                "description": "Version constraint for the system package"
                            },
                            "package_manager": {
                                "type": "string",
                                "enum": ["apt"],
                                "default": "apt",
                                "description": "Package manager to use for installation"
                            }
                        }
                    },
                    "description": "System packages required."
                },
                "docker": {
                    "type": "array",
                    "items": {
                        "type": "object",
                        "required": ["name", "version_constraint"],
                        "properties": {
                            "name": {
                                "type": "string",
                                "pattern": "^\\w+$",
                                "description": "Name of the Docker image"
                            },
                            "version_constraint": {
                                "type": "string",
                                "pattern": "^\\s*(==|>=|<=|!=)\\s*\\d+(\\.\\d+)*$",
                                "description": "Version constraint for the Docker image"
                            },
                            "registry": {
                                "type": "string",
                                "enum": ["dockerhub"],
                                "default": "dockerhub",
                                "description": "Registry to pull the Docker image from"
                            }
                        }
                    },
                    "description": "Docker images required."
                }
            }
        },
        "compatibility": {
            "type": "object",
            "properties": {
                "hatchling": {
                    "type": "string",
                    "pattern": "^\\s*(==|>=|<=|!=)\\s*\\d+(\\.\\d+)*$",
                    "description": "Version constraint for Hatchling compatibility, e.g., '>=0.1.0'"
                },
                "python": {
                    "type": "string",
                    "pattern": "^\\s*(==|>=|<=|!=)\\s*\\d+(\\.\\d+)*$",
                    "description": "Version constraint for Python compatibility, e.g., '>=3.6'"
                }
            }
        },
        "entry_point": {
            "type": "object",
            "description": "Dual entry point configuration for FastMCP server and HatchMCP wrapper",
            "properties": {
                "mcp_server": {
                    "type": "string",
                    "description": "FastMCP server implementation file",
                    "pattern": "^[a-zA-Z0-9_][a-zA-Z0-9_.-]*\\.py$"
                },
                "hatch_mcp_server": {
                    "type": "string",
                    "description": "HatchMCP wrapper file",
                    "pattern": "^[a-zA-Z0-9_][a-zA-Z0-9_.-]*\\.py$"
                }
            },
            "required": ["mcp_server", "hatch_mcp_server"],
            "additionalProperties": false
        },
        "tools": {
            "type": "array",
            "items": {
                "type": "object",
                "required": ["name", "description"],
                "properties": {
                    "name": {"type": "string"},
                    "description": {"type": "string"}
                }
            }
        },
        "citations": {
            "type": "object",
            "properties": {
                "origin": {"type": "string"},
                "mcp": {"type": "string"}
            }
        }
    },
    "additionalProperties": false
}
